<!ENTITY redteammotto "Strengthened through the challenge">

<!ELEMENT employees (employee)+>

<!ELEMENT employee (first,last,(deputy|manager), motto)>
<!ATTLIST employee
    id ID #REQUIRED>

<!ELEMENT first (#PCDATA)>

<!ELEMENT last (#PCDATA)>

<!ELEMENT deputy (#PCDATA)>
<!ATTLIST deputy
    ref IDREF #REQUIRED>

<!ELEMENT manager (#PCDATA)>
<!ATTLIST manager
    ref IDREF #REQUIRED>
    
<!ELEMENT motto (#PCDATA)>