<?xml version="1.0" encoding="UTF-8"?>
<!DOCTYPE employees SYSTEM "supports-dtd.dtd">
<employees>
	<employee id="E21256">
		<first>Anil</first>
		<last>Singh</last>
		<deputy ref="E30561" />
		<motto>&redteammotto;</motto>
	</employee>
	<employee id="E30561">
		<first>Anila</first>
		<last>Kaur</last>
		<manager ref="E21256" />
		<motto>&redteammotto;</motto>
	</employee>
</employees>